{"dataset":"events","api_version":"v1","schema_version":"1.1.0","schema_url":"https://blockchains.github.io/blockchainlab-api/v1/schemas/events.schema.json","description":"Upcoming blockchain events from the Blockchain Lab feeds.","generated_at":"2026-10-23T08:35:24.203Z","source":"Blockchains/blockchainlab-feeds (ethglobal.com/events; devpost.com (blockchain hackathons))","source_url":"https://raw.githubusercontent.com/Blockchains/blockchainlab-feeds/main/feeds/events/latest.json","built_by":"Blockchain Lab — https://blockchainlab.com","licence_note":"Data belongs to the named source; check its terms before reuse. Attribute the source and Blockchain Lab.","count":7,"upstream_generated_at":"2026-10-19T06:45:37Z","not_covered":[],"data":[{"source":"ethglobal","id":"ethglobal-734","title":"Ethereum Stablecoin Summit @ Money20/20 Las Vegas","url":"https://ethglobal.com/events/ethsummit-las-vegas","organizer":"ETHGlobal","type":"summit","start":"2026-10-19","end":"2026-10-19","medium":"physical","verified":"listed in ethglobal.com/events page data"},{"source":"ethglobal","id":"ethglobal-530","title":"Pragma Mumbai","url":"https://ethglobal.com/events/pragma-mumbai","organizer":"ETHGlobal","type":"summit","start":"2026-11-06","end":"2026-11-06","medium":"physical","verified":"listed in ethglobal.com/events page data"},{"source":"ethglobal","id":"ethglobal-712","title":"ETHConf 2027","url":"https://ethglobal.com/events/ethconf2027","organizer":"ETHGlobal","type":"summit","start":"2027-06-14","end":"2027-06-16","medium":"physical","verified":"listed in ethglobal.com/events page data"},{"source":"devpost","id":"devpost-31664","title":"Herhack","url":"https://herhack.devpost.com/","organizer":"Echelon institute of technology","type":"hackathon","dates":"Oct 17 - Nov 10, 2026","medium":"Online","verified":"listed on devpost.com API"},{"source":"devpost","id":"devpost-29114","title":"IEEE ClimateChain Global Hackathon","url":"https://ieee-climatechain-hack.devpost.com/","organizer":"IEEE Turkey","type":"hackathon","dates":"Oct 05 - 25, 2026","medium":"Online","verified":"listed on devpost.com API"},{"source":"devpost","id":"devpost-31534","title":"SUSTAIN-A-THON 2.0","url":"https://sustain-a-thon-2-0-31534.devpost.com/","organizer":"Sharda University Greater Noida","type":"hackathon","dates":"Oct 27 - 28, 2026","medium":"Block 45, Sharda University","verified":"listed on devpost.com API"},{"source":"ethglobal","id":"ethglobal-527","title":"ETHGlobal Mumbai","url":"https://ethglobal.com/events/mumbai","organizer":"ETHGlobal","type":"hackathon","dates":"2026-11-05 to 2026-11-07","medium":"physical","verified":"listed in ethglobal.com/events page data"}]}