{"dataset":"hackathons","api_version":"v1","schema_version":"1.1.0","schema_url":"https://blockchains.github.io/blockchainlab-api/v1/schemas/hackathons.schema.json","description":"Open and upcoming blockchain hackathons (Devpost, ETHGlobal).","generated_at":"2026-10-22T08:39:50.664Z","source":"Blockchains/blockchainlab-feeds (devpost.com/api/hackathons (theme Blockchain, open+upcoming); ethglobal.com/events (future hackathons); X posts (leads only))","source_url":"https://raw.githubusercontent.com/Blockchains/blockchainlab-feeds/main/feeds/hackathons/latest.json","built_by":"Blockchain Lab — https://blockchainlab.com","licence_note":"Data belongs to the named source; check its terms before reuse. Attribute the source and Blockchain Lab.","count":4,"upstream_generated_at":"2026-10-19T06:45:37Z","not_covered":["dorahacks.io (AWS WAF human verification blocks scripted fetch)","gitcoin (indexer not reachable from the box)"],"data":[{"source":"devpost","id":"devpost-31664","title":"Herhack","url":"https://herhack.devpost.com/","organizer":"Echelon institute of technology","dates":"Oct 17 - Nov 10, 2026","state":"open","prize":"₹ 200,000","location":"Online","registrations":9,"themes":["Beginner Friendly","Blockchain","Open Ended"],"verified":"listed on devpost.com API","first_seen":"2026-10-19","new":true},{"source":"devpost","id":"devpost-29114","title":"IEEE ClimateChain Global Hackathon","url":"https://ieee-climatechain-hack.devpost.com/","organizer":"IEEE Turkey","dates":"Oct 05 - 25, 2026","state":"open","prize":"$3,000","location":"Online","registrations":940,"themes":["Blockchain","Machine Learning/AI","Social Good"],"verified":"listed on devpost.com API","first_seen":"2026-10-03","new":false},{"source":"devpost","id":"devpost-31534","title":"SUSTAIN-A-THON 2.0","url":"https://sustain-a-thon-2-0-31534.devpost.com/","organizer":"Sharda University Greater Noida","dates":"Oct 27 - 28, 2026","state":"upcoming","prize":"$150,000","location":"Block 45, Sharda University","registrations":28,"themes":["Blockchain","Cybersecurity","IoT"],"verified":"listed on devpost.com API","first_seen":"2026-10-03","new":false},{"source":"ethglobal","id":"ethglobal-527","title":"ETHGlobal Mumbai","url":"https://ethglobal.com/events/mumbai","organizer":"ETHGlobal","dates":"2026-11-05 to 2026-11-07","state":"future","prize":null,"location":"physical","themes":["Ethereum"],"verified":"listed in ethglobal.com/events page data","first_seen":"2026-10-03","new":false}]}